{
  "key": "_fr_28816",
  "codes": {
    "icao": null,
    "iata": null,
    "gps": "LFDX",
    "local": null
  },
  "name": "Fumel Montayral Airfield",
  "type": "small_airport",
  "status": "open",
  "location": {
    "latitude": 44.460921,
    "longitude": 1.006708,
    "elevation_ft": 692,
    "iso_country": "FR",
    "iso_region": "FR-NAQ",
    "municipality": "Rochefort"
  },
  "keywords": [],
  "wikipedia": "https://fr.wikipedia.org/wiki/A%C3%A9rodrome_de_Fumel_-_Montayral",
  "metadata": {
    "created": "2026-06-21",
    "updated": "2026-06-21",
    "sources": [
      "ourairports"
    ],
    "curated": false,
    "source_id": 28816
  }
}
