{
  "key": "_ph_325875",
  "codes": {
    "icao": null,
    "iata": null,
    "gps": null,
    "local": null
  },
  "name": "BDO Corporate Center Heliport",
  "type": "heliport",
  "status": "open",
  "location": {
    "latitude": 14.585865,
    "longitude": 121.059189,
    "elevation_ft": 0,
    "iso_country": "PH",
    "iso_region": "PH-00",
    "municipality": "Mandaluyong"
  },
  "keywords": [
    "BDO Corporate Center",
    "PH-0038"
  ],
  "metadata": {
    "created": "2026-06-21",
    "updated": "2026-06-21",
    "sources": [
      "ourairports"
    ],
    "curated": false,
    "source_id": 325875
  }
}
