{
  "key": "_ve_601497",
  "codes": {
    "icao": null,
    "iata": null,
    "gps": null,
    "local": null
  },
  "name": "Gasoducto Irapa HLS",
  "type": "heliport",
  "status": "open",
  "location": {
    "latitude": 10.60199,
    "longitude": -62.658914,
    "elevation_ft": 65,
    "iso_country": "VE",
    "iso_region": "VE-R",
    "municipality": null
  },
  "keywords": [
    "VE-0323"
  ],
  "metadata": {
    "created": "2026-06-21",
    "updated": "2026-06-21",
    "sources": [
      "ourairports"
    ],
    "curated": false,
    "source_id": 601497
  }
}
