{
  "key": "_de_515017",
  "codes": {
    "icao": null,
    "iata": null,
    "gps": null,
    "local": null
  },
  "name": "Kamenz Heliport",
  "type": "heliport",
  "status": "open",
  "location": {
    "latitude": 51.2641,
    "longitude": 14.12522,
    "elevation_ft": 617,
    "iso_country": "DE",
    "iso_region": "DE-SN",
    "municipality": "Kamenz"
  },
  "keywords": [
    "DE-0634"
  ],
  "metadata": {
    "created": "2026-06-21",
    "updated": "2026-06-21",
    "sources": [
      "ourairports"
    ],
    "curated": false,
    "source_id": 515017
  }
}
