{
  "key": "diof",
  "codes": {
    "icao": "DIOF",
    "iata": "OFI",
    "gps": "DIOF",
    "local": null
  },
  "name": "Ouango Fitini Airport",
  "type": "small_airport",
  "status": "open",
  "location": {
    "latitude": 9.6,
    "longitude": -4.05,
    "elevation_ft": 974,
    "iso_country": "CI",
    "iso_region": "CI-ZZ",
    "municipality": "Ouango Fitini"
  },
  "keywords": [],
  "wikipedia": "https://en.wikipedia.org/wiki/Ouango_Fitini_Airport",
  "metadata": {
    "created": "2026-06-21",
    "updated": "2026-06-21",
    "sources": [
      "ourairports"
    ],
    "curated": false,
    "source_id": 32095
  }
}
