{
  "key": "_us_08807",
  "codes": {
    "icao": null,
    "iata": null,
    "gps": null,
    "local": null
  },
  "name": "Will and Wiley's Aerodrome",
  "type": "closed",
  "status": "closed",
  "location": {
    "latitude": 36.325699,
    "longitude": -95.646896,
    "elevation_ft": 700,
    "iso_country": "US",
    "iso_region": "US-OK",
    "municipality": "Claremore"
  },
  "keywords": [
    "20OK",
    "US-9742"
  ],
  "metadata": {
    "created": "2026-06-21",
    "updated": "2026-06-21",
    "sources": [
      "ourairports"
    ],
    "curated": false,
    "source_id": 8807
  }
}
