{
  "key": "_us_17601",
  "codes": {
    "icao": null,
    "iata": null,
    "gps": "H07",
    "local": "H07"
  },
  "name": "Highland-Winet Airport",
  "type": "small_airport",
  "status": "open",
  "location": {
    "latitude": 38.779301,
    "longitude": -89.640404,
    "elevation_ft": 537,
    "iso_country": "US",
    "iso_region": "US-IL",
    "municipality": "Highland"
  },
  "keywords": [],
  "wikipedia": "https://en.wikipedia.org/wiki/Highland-Winet_Airport",
  "metadata": {
    "created": "2026-06-21",
    "updated": "2026-06-21",
    "sources": [
      "ourairports"
    ],
    "curated": false,
    "source_id": 17601
  }
}
