{
  "key": "_us_23492",
  "codes": {
    "icao": null,
    "iata": null,
    "gps": "KO39",
    "local": "O39"
  },
  "name": "Ravendale Airport",
  "type": "small_airport",
  "status": "open",
  "location": {
    "latitude": 40.803593,
    "longitude": -120.366193,
    "elevation_ft": 5299,
    "iso_country": "US",
    "iso_region": "US-CA",
    "municipality": "Ravendale"
  },
  "keywords": [],
  "metadata": {
    "created": "2026-06-21",
    "updated": "2026-06-21",
    "sources": [
      "ourairports"
    ],
    "curated": false,
    "source_id": 23492
  }
}
