{
  "key": "_us_20421",
  "codes": {
    "icao": null,
    "iata": null,
    "gps": "KM25",
    "local": "M25"
  },
  "name": "Mayfield Graves County Airport",
  "type": "small_airport",
  "status": "open",
  "location": {
    "latitude": 36.7691,
    "longitude": -88.584702,
    "elevation_ft": 523,
    "iso_country": "US",
    "iso_region": "US-KY",
    "municipality": "Mayfield"
  },
  "keywords": [],
  "metadata": {
    "created": "2026-06-21",
    "updated": "2026-06-21",
    "sources": [
      "ourairports"
    ],
    "curated": false,
    "source_id": 20421
  }
}
