{
  "key": "_jp_323826",
  "codes": {
    "icao": null,
    "iata": null,
    "gps": "RJCY",
    "local": null
  },
  "name": "JASDF Yakumo Airbase",
  "type": "small_airport",
  "status": "open",
  "location": {
    "latitude": 42.245955,
    "longitude": 140.265729,
    "elevation_ft": 65,
    "iso_country": "JP",
    "iso_region": "JP-01",
    "municipality": "Yakumo"
  },
  "keywords": [
    "RJCY",
    "Yakumo",
    "JASDF",
    "QRN"
  ],
  "wikipedia": "https://en.wikipedia.org/wiki/Yakumo_Sub_Base",
  "metadata": {
    "created": "2026-06-21",
    "updated": "2026-06-21",
    "sources": [
      "ourairports"
    ],
    "curated": false,
    "source_id": 323826
  }
}
