{
  "key": "_it_610020",
  "codes": {
    "icao": null,
    "iata": null,
    "gps": null,
    "local": null
  },
  "name": "Casteldelfino Heliport",
  "type": "heliport",
  "status": "open",
  "location": {
    "latitude": 44.586098,
    "longitude": 7.077385,
    "elevation_ft": 0,
    "iso_country": "IT",
    "iso_region": "IT-21",
    "municipality": "Casteldelfino"
  },
  "keywords": [
    "IT-0993"
  ],
  "metadata": {
    "created": "2026-08-17",
    "updated": "2026-08-17",
    "sources": [
      "ourairports"
    ],
    "curated": false,
    "source_id": 610020
  }
}
