{
  "key": "_us_347251",
  "codes": {
    "icao": null,
    "iata": null,
    "gps": null,
    "local": null
  },
  "name": "Electra Memorial Hospital Heliport",
  "type": "heliport",
  "status": "open",
  "location": {
    "latitude": 34.01866,
    "longitude": -98.92515,
    "elevation_ft": 1221,
    "iso_country": "US",
    "iso_region": "US-TX",
    "municipality": "Electra"
  },
  "keywords": [
    "US-5023"
  ],
  "metadata": {
    "created": "2026-06-21",
    "updated": "2026-06-21",
    "sources": [
      "ourairports"
    ],
    "curated": false,
    "source_id": 347251
  }
}
