{
  "key": "kdvt",
  "codes": {
    "icao": "KDVT",
    "iata": "DVT",
    "gps": "KDVT",
    "local": "DVT"
  },
  "name": "Phoenix Deer Valley Airport",
  "type": "small_airport",
  "status": "open",
  "location": {
    "latitude": 33.688301,
    "longitude": -112.083,
    "elevation_ft": 1478,
    "iso_country": "US",
    "iso_region": "US-AZ",
    "municipality": "Phoenix"
  },
  "keywords": [],
  "wikipedia": "https://en.wikipedia.org/wiki/Phoenix_Deer_Valley_Airport",
  "metadata": {
    "created": "2026-06-21",
    "updated": "2026-06-21",
    "sources": [
      "ourairports"
    ],
    "curated": false,
    "source_id": 19672
  }
}
