{
  "key": "cyxq",
  "codes": {
    "icao": "CYXQ",
    "iata": "YXQ",
    "gps": "CYXQ",
    "local": null
  },
  "name": "Beaver Creek Airport",
  "type": "medium_airport",
  "status": "open",
  "location": {
    "latitude": 62.410301,
    "longitude": -140.867004,
    "elevation_ft": 2131,
    "iso_country": "CA",
    "iso_region": "CA-YT",
    "municipality": "Beaver Creek"
  },
  "keywords": [],
  "wikipedia": "https://en.wikipedia.org/wiki/Beaver_Creek_Airport",
  "metadata": {
    "created": "2026-06-21",
    "updated": "2026-06-21",
    "sources": [
      "ourairports"
    ],
    "curated": false,
    "source_id": 1964
  }
}
