{
  "key": "_us_16634",
  "codes": {
    "icao": null,
    "iata": null,
    "gps": "CD03",
    "local": "CD03"
  },
  "name": "Tinnes Airport",
  "type": "small_airport",
  "status": "open",
  "location": {
    "latitude": 38.198226,
    "longitude": -102.5669,
    "elevation_ft": 3850,
    "iso_country": "US",
    "iso_region": "US-CO",
    "municipality": "Lamar"
  },
  "keywords": [],
  "metadata": {
    "created": "2026-06-21",
    "updated": "2026-06-21",
    "sources": [
      "ourairports"
    ],
    "curated": false,
    "source_id": 16634
  }
}
