{
  "key": "_sa_354448",
  "codes": {
    "icao": null,
    "iata": null,
    "gps": null,
    "local": null
  },
  "name": "King Fahad Hospital Helipad",
  "type": "heliport",
  "status": "open",
  "location": {
    "latitude": 24.7503,
    "longitude": 46.854334,
    "elevation_ft": 0,
    "iso_country": "SA",
    "iso_region": "SA-01",
    "municipality": "Riyadh"
  },
  "keywords": [
    "SA-0059"
  ],
  "metadata": {
    "created": "2026-06-21",
    "updated": "2026-06-21",
    "sources": [
      "ourairports"
    ],
    "curated": false,
    "source_id": 354448
  }
}
