{
  "key": "_br_36481",
  "codes": {
    "icao": null,
    "iata": null,
    "gps": null,
    "local": null
  },
  "name": "Fazenda S.M. Airport",
  "type": "small_airport",
  "status": "open",
  "location": {
    "latitude": -14.547881,
    "longitude": -45.778962,
    "elevation_ft": 2891,
    "iso_country": "BR",
    "iso_region": "BR-BA",
    "municipality": "Jaborandi"
  },
  "keywords": [
    "SJDH",
    "BR-2589"
  ],
  "metadata": {
    "created": "2026-06-21",
    "updated": "2026-06-21",
    "sources": [
      "ourairports"
    ],
    "curated": false,
    "source_id": 36481
  }
}
