{
  "key": "_jp_508725",
  "codes": {
    "icao": null,
    "iata": null,
    "gps": null,
    "local": null
  },
  "name": "Yobokori Heliport",
  "type": "heliport",
  "status": "open",
  "location": {
    "latitude": 33.39131,
    "longitude": 132.08004,
    "elevation_ft": 119,
    "iso_country": "JP",
    "iso_region": "JP-38",
    "municipality": "Ikata"
  },
  "keywords": [
    "JP-3239"
  ],
  "metadata": {
    "created": "2026-06-21",
    "updated": "2026-06-21",
    "sources": [
      "ourairports"
    ],
    "curated": false,
    "source_id": 508725
  }
}
