{
  "key": "_ua_329398",
  "codes": {
    "icao": null,
    "iata": null,
    "gps": null,
    "local": null
  },
  "name": "Biloyarivka Airstrip",
  "type": "closed",
  "status": "closed",
  "location": {
    "latitude": 47.810729,
    "longitude": 38.629275,
    "elevation_ft": 347,
    "iso_country": "UA",
    "iso_region": "UA-14",
    "municipality": "Biloyarivka"
  },
  "keywords": [
    "UA-0123"
  ],
  "metadata": {
    "created": "2026-06-21",
    "updated": "2026-06-21",
    "sources": [
      "ourairports"
    ],
    "curated": false,
    "source_id": 329398
  }
}
