{
  "key": "_cz_320355",
  "codes": {
    "icao": null,
    "iata": null,
    "gps": null,
    "local": "LKDUSN"
  },
  "name": "Dušníky Ultralight Airfield",
  "type": "small_airport",
  "status": "open",
  "location": {
    "latitude": 50.412778,
    "longitude": 14.198056,
    "elevation_ft": 728,
    "iso_country": "CZ",
    "iso_region": "CZ-US",
    "municipality": "Dušníky"
  },
  "keywords": [
    "CZ-0109"
  ],
  "metadata": {
    "created": "2026-06-21",
    "updated": "2026-06-21",
    "sources": [
      "ourairports"
    ],
    "curated": false,
    "source_id": 320355
  }
}
