{
  "key": "_xk_594423",
  "codes": {
    "icao": null,
    "iata": null,
    "gps": null,
    "local": null
  },
  "name": "Marinë Airfield",
  "type": "closed",
  "status": "closed",
  "location": {
    "latitude": 42.70257,
    "longitude": 20.82276,
    "elevation_ft": 2123,
    "iso_country": "XK",
    "iso_region": "XK-07",
    "municipality": "Morinë"
  },
  "keywords": [
    "Marina",
    "Morinë",
    "XK-0012"
  ],
  "metadata": {
    "created": "2026-06-21",
    "updated": "2026-06-21",
    "sources": [
      "ourairports"
    ],
    "curated": false,
    "source_id": 594423
  }
}
