{
  "key": "_us_345711",
  "codes": {
    "icao": null,
    "iata": null,
    "gps": null,
    "local": null
  },
  "name": "Cobre Valley Regional Medical Center Heliport",
  "type": "heliport",
  "status": "open",
  "location": {
    "latitude": 33.40626,
    "longitude": -110.82724,
    "elevation_ft": 3376,
    "iso_country": "US",
    "iso_region": "US-AZ",
    "municipality": "Globe"
  },
  "keywords": [
    "US-4515"
  ],
  "metadata": {
    "created": "2026-06-21",
    "updated": "2026-06-21",
    "sources": [
      "ourairports"
    ],
    "curated": false,
    "source_id": 345711
  }
}
