{
  "key": "_cn_605838",
  "codes": {
    "icao": null,
    "iata": null,
    "gps": null,
    "local": null
  },
  "name": "Dunhuang Yadan Airport",
  "type": "small_airport",
  "status": "open",
  "location": {
    "latitude": 40.54683,
    "longitude": 93.11476,
    "elevation_ft": 2831,
    "iso_country": "CN",
    "iso_region": "CN-62",
    "municipality": "Dunhuang"
  },
  "keywords": [
    "CN-0489"
  ],
  "metadata": {
    "created": "2026-06-21",
    "updated": "2026-06-21",
    "sources": [
      "ourairports"
    ],
    "curated": false,
    "source_id": 605838
  }
}
