{
  "key": "_us_13831",
  "codes": {
    "icao": null,
    "iata": null,
    "gps": "74WI",
    "local": "74WI"
  },
  "name": "Witi Tv Studio Building Heliport",
  "type": "heliport",
  "status": "open",
  "location": {
    "latitude": 43.181099,
    "longitude": -87.963402,
    "elevation_ft": 660,
    "iso_country": "US",
    "iso_region": "US-WI",
    "municipality": "Brown Deer"
  },
  "keywords": [],
  "metadata": {
    "created": "2026-06-21",
    "updated": "2026-06-21",
    "sources": [
      "ourairports"
    ],
    "curated": false,
    "source_id": 13831
  }
}
